{
  "event_id": "evt_20260327_0005",
  "event_type": "chirpstack_uplink",
  "created_at": "2026-03-27T09:24:40Z",
  "project_id": "P-123",
  "workstream": "edge_node",
  "state": "live",
  "product_id": "SOIT-SCOMM-CF-MD-RAK4630-RAK5802-MFM384",
  "variant": "AS9231_RS485_9600N81",
  "trace_id": "trace_6c93e7e3_0005",
  "source": {
    "system": "chirpstack",
    "version": "4.8.1"
  },
  "payload": {
    "dev_eui": "A1B2C3D4E5F60708",
    "f_cnt": 139,
    "f_port": 10,
    "rx_info": {
      "gateway_id": "00800000A000B001",
      "rssi": -89,
      "snr": 7.5
    },
    "received_at": "2026-03-27T09:24:39Z"
  }
}
